professor_name,school_name,department_name,local_name,state_name,year_since_first_review,star_rating,take_again,diff_index,tag_professor,num_student,post_date,name_onlines,student_star,student_difficult,attence,for_credits,would_take_agains,grades,stu_tags,help_useful,help_not_useful,comments
Alicia  Drozd,Santa Ana College,Family & Consumer Science department, Santa Ana, CA,6,4.5,N/A,2.0,LECTURE HEAVY (2)  ACCESSIBLE OUTSIDE CLASS (1)  Caring (1)  Tough Grader (1)  EXTRA CREDIT (1),8,02/03/2017,NUTRITION115,2.0,4.0,Not Mandatory,Yes,No,D,LECTURE HEAVY  TOUGH GRADER  CARING,0,0,"She will lecture most of the class, so be ready to take notes, she has about 80 to 100 powerpoint slides per class, she only assigns 3 projects and no homework, but the projects can be kind of confusing she will however let you redo them, she only has 2 big tests mid term and final but they are hard, and there are pop quizzes after every class."
Alicia  Drozd,Santa Ana College,Family & Consumer Science department, Santa Ana, CA,6,4.5,N/A,2.0,LECTURE HEAVY (2)  ACCESSIBLE OUTSIDE CLASS (1)  Caring (1)  Tough Grader (1)  EXTRA CREDIT (1),8,01/25/2017,NUT115,4.0,1.0,Mandatory,Yes,No,A+,LECTURE HEAVY  ACCESSIBLE OUTSIDE CLASS  EXTRA CREDIT,0,0,One of the nicest teachers I\'ve ever had. Super easy A. She should teach kindergarten!
Alicia  Drozd,Santa Ana College,Family & Consumer Science department, Santa Ana, CA,6,4.5,N/A,2.0,LECTURE HEAVY (2)  ACCESSIBLE OUTSIDE CLASS (1)  Caring (1)  Tough Grader (1)  EXTRA CREDIT (1),8,12/18/2013,NUTR115,5.0,3.0,Mandatory,N/A,N/A,A+,,0,0,"She was amazing, best nutrition teacher ever. very entertaining and helpful."
Alicia  Drozd,Santa Ana College,Family & Consumer Science department, Santa Ana, CA,6,4.5,N/A,2.0,LECTURE HEAVY (2)  ACCESSIBLE OUTSIDE CLASS (1)  Caring (1)  Tough Grader (1)  EXTRA CREDIT (1),8,05/29/2013,NUTRITION115,5.0,2.0,N/A,N/A,N/A,N/A,,0,0,"She is the nicest teacher you could ask for, caring and very informative! Great class learned a lot."
Alicia  Drozd,Santa Ana College,Family & Consumer Science department, Santa Ana, CA,6,4.5,N/A,2.0,LECTURE HEAVY (2)  ACCESSIBLE OUTSIDE CLASS (1)  Caring (1)  Tough Grader (1)  EXTRA CREDIT (1),8,07/21/2012,NUTRI115,5.0,1.0,N/A,N/A,N/A,N/A,,0,0,Easy A if you complete the assignments (very easy).She goes through every assignment when they are given. Exams aren\'t difficult if you attend class and fill out the lecture outlines. And if you aren\'t ready for an exam she will let you take it another day at the testing center!!! nicest teacher ever its clear that she cares about her student.
Alicia  Drozd,Santa Ana College,Family & Consumer Science department, Santa Ana, CA,6,4.5,N/A,2.0,LECTURE HEAVY (2)  ACCESSIBLE OUTSIDE CLASS (1)  Caring (1)  Tough Grader (1)  EXTRA CREDIT (1),8,12/14/2011,NUTRI115,5.0,1.0,N/A,N/A,N/A,N/A,,0,0,"Nicest teacher you could find at SAC. Easy class if you do the exam reviews and put some effort on the assignments, which arent that hard. 4 exams(about 3 chapters each), a non-comulative final, and 4 assignments."
Alicia  Drozd,Santa Ana College,Family & Consumer Science department, Santa Ana, CA,6,4.5,N/A,2.0,LECTURE HEAVY (2)  ACCESSIBLE OUTSIDE CLASS (1)  Caring (1)  Tough Grader (1)  EXTRA CREDIT (1),8,11/29/2011,NUTRI115,5.0,2.0,N/A,N/A,N/A,N/A,,0,0,"3 tests, one final, and 4 major assignments. Gives out a review before the test, which helps out a lot. Just study, do the assignments, and you will be fine."
Alicia  Drozd,Santa Ana College,Family & Consumer Science department, Santa Ana, CA,6,4.5,N/A,2.0,LECTURE HEAVY (2)  ACCESSIBLE OUTSIDE CLASS (1)  Caring (1)  Tough Grader (1)  EXTRA CREDIT (1),8,03/08/2011,NUTRI4359,5.0,2.0,N/A,N/A,N/A,N/A,,0,0,"she was very helpful clear, her homework assignment were easy, her test were easy and she gave you a study guide right before the test."
